{
  "$schema": "commissions.schema.json",
  "schema": "rapp-vision-commissions/1.0",
  "id": "rapp-vision-launch-slate",
  "name": "RAPP Vision launch commissions",
  "brand": "RAPP Vision",
  "status": "open",
  "claim_policy": {
    "phase": "claim",
    "effect": "coordination-only",
    "curation": "none",
    "note": "A claim helps creators avoid accidental duplication. It grants no review role, acceptance, publication, or default-registry position."
  },
  "submission_protocol": "docs/CREATOR-INGRESS.md",
  "submission_schema": "submission.schema.json",
  "quality_schema": "quality.schema.json",
  "commissions": [
    {
      "id": "use-offline-field-log",
      "title": "Recover an offline field log",
      "category": "use",
      "status": "open",
      "brief": "Show a local-first field log surviving a cold reload without network access, exporting a verifiable record, and rejecting a damaged import without losing the good copy.",
      "gates": {
        "paired_delivery": {
          "mp4": true,
          "webm": true,
          "live": true,
          "same_publication": true
        },
        "objective_evidence": {
          "required": true,
          "criterion": "After the supplied twelve-observation fixture is loaded and the network is disabled, a cold reload still shows 12 observations and the exported file reports the fixture's expected SHA-256.",
          "acceptance": "The film names the expected count and digest; the live replay exposes both values in the running app."
        },
        "positive_path": {
          "required": true,
          "demonstration": "Create one observation, reload offline, find it again, and export the complete log."
        },
        "visible_failure": {
          "required": true,
          "demonstration": "Attempt to import a deliberately truncated fixture and show a visible rejection while the twelve good observations remain."
        },
        "exact_reset": {
          "required": true,
          "steps": [
            "Activate Reset demo data.",
            "Confirm the reset dialog.",
            "Reload the page with the network disabled."
          ],
          "restored_state": "The supplied twelve-observation fixture is present, no extra draft remains, and the export digest returns to the documented fixture value."
        },
        "rights_privacy": {
          "rights_attestation": true,
          "privacy_attestation": true,
          "no_secrets": true,
          "scope": "Use synthetic field notes and creator-owned interface assets only."
        },
        "review_quorum": {
          "minimum_approvals": 2,
          "required_roles": [
            "technical",
            "curation"
          ],
          "independent_reviewers": true
        }
      }
    },
    {
      "id": "use-keyboard-invoice-triage",
      "title": "Triage invoices without a pointer",
      "category": "use",
      "status": "open",
      "brief": "Demonstrate a small invoice queue that can be reviewed, corrected, and exported using only a keyboard and a visible focus path.",
      "gates": {
        "paired_delivery": {
          "mp4": true,
          "webm": true,
          "live": true,
          "same_publication": true
        },
        "objective_evidence": {
          "required": true,
          "criterion": "The three-invoice fixture totals 196.25, every control is reachable by keyboard, and the exported accepted-total field is exactly 196.25.",
          "acceptance": "The film states the expected total; the live replay shows keyboard focus, the computed total, and the exported value."
        },
        "positive_path": {
          "required": true,
          "demonstration": "Using Tab, arrow keys, and Enter only, accept two invoices, correct the third, and export the queue."
        },
        "visible_failure": {
          "required": true,
          "demonstration": "Enter a negative amount and show an inline error, disabled export, and focus moved to the invalid field."
        },
        "exact_reset": {
          "required": true,
          "steps": [
            "Activate Restore invoice fixture.",
            "Confirm replacement of local edits.",
            "Move focus to the first invoice row."
          ],
          "restored_state": "All three invoices are pending, the displayed total is 196.25, no validation error is visible, and focus is on the first row."
        },
        "rights_privacy": {
          "rights_attestation": true,
          "privacy_attestation": true,
          "no_secrets": true,
          "scope": "All people, vendors, account numbers, and invoice values must be synthetic."
        },
        "review_quorum": {
          "minimum_approvals": 2,
          "required_roles": [
            "technical",
            "curation"
          ],
          "independent_reviewers": true
        }
      }
    },
    {
      "id": "learn-orbit-transfer",
      "title": "Teach one orbital transfer by prediction",
      "category": "learn",
      "status": "open",
      "brief": "Teach a Hohmann-style transfer by asking the learner for a prediction before revealing the simulation and numerical result.",
      "gates": {
        "paired_delivery": {
          "mp4": true,
          "webm": true,
          "live": true,
          "same_publication": true
        },
        "objective_evidence": {
          "required": true,
          "criterion": "For the embedded training fixture, the computed total delta-v must equal the fixture's documented 3.58 km/s within 0.01 km/s and the trajectory must intersect the target-orbit tolerance band.",
          "acceptance": "The formula inputs, computed value, tolerance, and final intersection are readable in both modes."
        },
        "positive_path": {
          "required": true,
          "demonstration": "Record a learner prediction, run the two burns, and compare the predicted and measured delta-v."
        },
        "visible_failure": {
          "required": true,
          "demonstration": "Apply the provided under-burn preset and show the craft miss the target band with the numerical shortfall visible."
        },
        "exact_reset": {
          "required": true,
          "steps": [
            "Activate Reset lesson.",
            "Select the training fixture.",
            "Set simulation time to zero."
          ],
          "restored_state": "The original radii and mass are restored, no prediction is recorded, both burns are unapplied, and time reads 0.00."
        },
        "rights_privacy": {
          "rights_attestation": true,
          "privacy_attestation": true,
          "no_secrets": true,
          "scope": "Use original diagrams, public-domain references, or clearly attributed compatible sources."
        },
        "review_quorum": {
          "minimum_approvals": 2,
          "required_roles": [
            "technical",
            "curation"
          ],
          "independent_reviewers": true
        }
      }
    },
    {
      "id": "learn-grid-overflow",
      "title": "Explain why a grid overflows",
      "category": "learn",
      "status": "open",
      "brief": "Turn one common CSS Grid overflow bug into an inspectable lesson with a before state, a measured diagnosis, and a fix the viewer can undo.",
      "gates": {
        "paired_delivery": {
          "mp4": true,
          "webm": true,
          "live": true,
          "same_publication": true
        },
        "objective_evidence": {
          "required": true,
          "criterion": "The failing fixture has scrollWidth greater than clientWidth at 320 px; after the fix those values are equal at both 320 px and 1280 px.",
          "acceptance": "The exact viewport, scrollWidth, and clientWidth values are displayed before and after the change."
        },
        "positive_path": {
          "required": true,
          "demonstration": "Inspect the overflowing track, apply the minmax or min-width fix, and verify both target viewport widths."
        },
        "visible_failure": {
          "required": true,
          "demonstration": "Restore the unbreakable-token fixture and visibly reproduce horizontal scrolling at 320 px."
        },
        "exact_reset": {
          "required": true,
          "steps": [
            "Activate Restore broken CSS.",
            "Set the viewport control to 320 px.",
            "Scroll the preview back to x = 0."
          ],
          "restored_state": "The original CSS text, long token, 320 px viewport, and measured overflow are identical to the opening state."
        },
        "rights_privacy": {
          "rights_attestation": true,
          "privacy_attestation": true,
          "no_secrets": true,
          "scope": "The lesson source, fixture text, fonts, and screenshots must be redistributable."
        },
        "review_quorum": {
          "minimum_approvals": 2,
          "required_roles": [
            "technical",
            "curation"
          ],
          "independent_reviewers": true
        }
      }
    },
    {
      "id": "prove-deterministic-hive-merge",
      "title": "Prove a deterministic Hive merge",
      "category": "prove",
      "status": "open",
      "brief": "Build a small visual proof of RAPP Hive traversal, revision selection, and channel shadowing using fixed local fixtures and no network dependency.",
      "gates": {
        "paired_delivery": {
          "mp4": true,
          "webm": true,
          "live": true,
          "same_publication": true
        },
        "objective_evidence": {
          "required": true,
          "criterion": "For the supplied cyclic three-Hive fixture, traversal terminates after three unique Hives, revision sequence 9 wins for the duplicate Hive id, and the root-priority channel entry wins the shadow conflict.",
          "acceptance": "The visited order, selected revision, winning channel source, and shadowed source are emitted as inspectable data."
        },